{
  "job_id": "9f1c2e7a-4b6d-4f8a-9c10-2b3d4e5f6a7b",
  "brand": "Acme",
  "format": "carousel_3x4",
  "briefing": "Quero educar pequenos empreendedores sobre os erros que sabotam o resultado no Instagram e mostrar como corrigir cada um. Tom encorajador e prático.",
  "objective": "education",
  "audience": "Marina — a microempreendedora digital"
}
